{
  "schema_version": 1,
  "title": "Peanut Admin 产品能力与交付状态",
  "visibility": "internal",
  "facts_baseline": {
    "branch": "main",
    "commit": "48c1a86b5e964ca0721757897d56a810455f1e54",
    "reviewed_at": "2026-09-09"
  },
  "overall": {
    "id": "PA-ROADMAP-001",
    "status": "in_progress",
    "summary": "当前正式 Application 仍为 v3.0.14，其固定源码 P0-E、双 Edition 安装/同 Edition 升级包与多租户 Demo 回执属于对应历史身份。2026-09-13 对远端 dev 的有界核对确认：Core PHP/Web 3.1.0 已完成 Q01/D05 并公开发布；Application 已采用真实 Composer/pnpm 3.1.0 locks、V2 产品/Instance 身份和同源双 Edition 生成输入。首次 main@240eab8f 候选在六组 P0-E 通过后因浏览器失败失效；浏览器修正和已安装 Plugin 保护已进入 main@ffe90c7e，但后续升级与资格准备仍未完成，不能据此赋予新候选资格。CR03 最终完整 P0-E、正式旧实例升级/数据读回/失败恢复及四端业务验收仍待完成；没有 Application 3.1.0 Release、正式升级或部署结论。当前执行停止点与恢复条件只从唯一私有状态读取。2026-09-13 本轮重新审计并修复 Application Web 的 ECharts、decode-uri-component 及 UniApp 非 Vite 告警，Server Composer、Web、Platform、PC、Docs Site 均为零告警；UniApp 固定 Vite 5.2.8 high 继续按 DCloud 精确 peer 合同保留受控构建、无公网开发服务器及 2026-10-09 到期复核的窄例外，不能宣称漏洞清零。Core Composer、根 Web 与生成 Starter 审计为零；Core 供应链总检查因当前工作树缺少 vendor/bin/phpunit 在允许的恢复重跑后停止，不据局部结果宣称整组通过。C02—C12 仅非消费阻塞部分后置；真实 Provider 资格按各自资源和授权分别记录，Marketplace、T16、跨实例运营平台与完整 SaaS 按各自范围后置。"
  },
  "capabilities": [
    {
      "id": "PA-NATIVE-001",
      "name": "2.0.0 原生身份与干净安装基线",
      "area": "foundation",
      "status": "verified",
      "summary": "原生管理身份、独立业务会员、canonical fresh Schema、官方能力强制 Tenant 资格、头像 fallback、本地域名显式白名单和 fresh-only P0-E Runtime 已实现。固定候选 78e9667 的最终 P0-E 七组全部通过，并已作为 v2.0.0 正式源码 Release 发布。",
      "acceptance": [
        "Standalone 与 multi-tenant 从空库安装同一 canonical Schema",
        "管理端登录、Tenant 选择、RBAC 和暂停拒绝只使用原生身份链",
        "create-app 2.0.0 生成物与源仓 Schema、Runtime 和文档一致",
        "当前交付的官方能力全部通过强制 Tenant 资格合同",
        "公开文档只指向 fresh install，不把 1.x 历史写成当前能力"
      ],
      "evidence": [
        {
          "kind": "document",
          "ref": "docs/architecture/clean-native-multitenancy-baseline.md"
        },
        {
          "kind": "git",
          "ref": "78e9667f763591e1505054ec39fa060078b88d26"
        },
        {
          "kind": "report",
          "ref": "output/p0e-p0e78e9667/summary.json"
        },
        {
          "kind": "resource",
          "ref": "resources/project-resources.json"
        },
        {
          "kind": "tag",
          "ref": "v2.0.0"
        },
        {
          "kind": "release",
          "ref": "https://github.com/peanut-business/peanut-admin/releases/tag/v2.0.0"
        }
      ],
      "dependencies": [
        "PA-TENANCY-001",
        "PA-OWNERSHIP-001"
      ],
      "paths": [
        "server/database/init.sql",
        "server/database/install.php",
        "server/tests/Multitenancy/NativeAdminIdentityRuntimeContractTest.php",
        "server/tests/Multitenancy/OfficialCapabilityTenantQualificationTest.php",
        "server/tests/Productization/FreshSchemaBaselineTest.php",
        "scaffold/application-template-inventory.json"
      ]
    },
    {
      "id": "PA-FOUNDATION-001",
      "name": "1.x LikeAdmin 标准版基础能力对齐（历史）",
      "area": "foundation",
      "status": "verified",
      "summary": "基础后台能力、空库安装、迁移账本和代表路由已有独立验证。",
      "acceptance": [
        "空库安装形成完整基础表、菜单、配置和初始管理员",
        "代表管理端路由通过真实浏览器回归",
        "fresh、legacy adopt 与幂等重跑均有迁移证据"
      ],
      "evidence": [
        {
          "kind": "document",
          "ref": "docs/likeadmin-parity-report.md"
        },
        {
          "kind": "report",
          "ref": "output/playwright/v02/summary.json"
        }
      ],
      "paths": [
        "server/database/install.php"
      ]
    },
    {
      "id": "PA-INSTALL-001",
      "name": "统一只读安装预检",
      "area": "productization",
      "status": "verified",
      "summary": "PC10 已在 dev 形成 CLI、未来 Web 与自动化共用的唯一只读安装预检 Host；稳定返回状态、代码、原因和修复建议，不连接数据库、不猜测地址或凭据，并裁剪资源秘密。PC70 pc70q14 已在固定派生应用候选完成 P0-E 7/7 组合资格。",
      "acceptance": [
        "PHP、扩展、安装文件、目录和登记资源身份使用同一结构化检查",
        "CLI 返回稳定 status、code、reason、remediation 和退出码",
        "预检不实例化 PDO、不探测网络、不创建目录且不泄露数据库秘密",
        "派生应用 app-owned inventory 包含预检 Host 和 CLI 入口"
      ],
      "evidence": [
        {
          "kind": "git",
          "ref": "f289c69a620f1eaffb0ba5a8cc39d089759259ab"
        },
        {
          "kind": "document",
          "ref": "docs/product-status/product-closure-observability.md"
        }
      ],
      "dependencies": [
        "PA-NATIVE-001"
      ],
      "paths": [
        "server/app/common/service/installation/InstallationPreflightHost.php",
        "server/database/install.php",
        "server/tests/Productization/InstallerBootstrapTest.php",
        "scaffold/application-template-inventory.json"
      ]
    },
    {
      "id": "PA-INSTALL-002",
      "name": "一次性引导安装",
      "area": "productization",
      "status": "verified",
      "summary": "PC11 已由 PR #279 合入 dev：guided/automatic 共用唯一执行 Host、一次性 setup token、安装态 fail-closed、官方 Module 选择和 Admin Web 向导已形成；Standalone/Multi-tenant 登记空库资格与 Web 生产构建通过。PC70 pc70q14 已在固定派生应用候选完成 P0-E 7/7 组合资格。",
      "acceptance": [
        "guided 模式只接受同源请求、Bearer setup token 和固定白名单输入",
        "安装身份只在安装进程或请求内存中使用，不写入 server/.env 或资格证据",
        "Standalone 与 Multi-tenant 空库均形成 91 张表、8 个已安装且启用的官方 Module",
        "安装后状态锁死，重复执行返回 INSTALL_ALREADY_COMPLETED",
        "Admin Web 安装路由和生产构建通过"
      ],
      "evidence": [
        {
          "kind": "git",
          "ref": "d80337b6d7b800558131968e65f8039cb8781912"
        },
        {
          "kind": "git",
          "ref": "7684a5fcb4bd23cdd966ab760d16a8130ba41ced"
        },
        {
          "kind": "pull_request",
          "ref": "https://github.com/peanut-business/peanut-admin/pull/279"
        },
        {
          "kind": "report",
          "ref": "output/p0e-pc11e1/pc11-summary.json"
        },
        {
          "kind": "document",
          "ref": "docs/product-status/product-closure-observability.md"
        }
      ],
      "dependencies": [
        "PA-INSTALL-001",
        "PA-PLUGIN-001"
      ],
      "paths": [
        "server/app/common/service/installation/InstallationExecutionHost.php",
        "server/app/common/http/middleware/InstallationStateMiddleware.php",
        "server/app/installation/controller/InstallationController.php",
        "web/src/views/installation/index.vue",
        "deploy/docker/php-entrypoint.sh"
      ]
    },
    {
      "id": "PA-READINESS-001",
      "name": "首次运行生产准备清单",
      "area": "productization",
      "status": "verified",
      "summary": "PC12 已由 PR #281 合入 dev：Tenant 安全的只读 Host 与 Admin 页面统一展示品牌、通知、存储、备份、Worker、当前域名/TLS 和账户安全的状态、影响、入口与生产阻塞性；状态严格区分本地配置、当前请求观察、未验证和尚未实施。PC70 pc70q14 已在固定派生应用候选完成 P0-E 7/7 组合资格。",
      "acceptance": [
        "每项都返回稳定状态、影响、下一动作、配置入口或责任方，以及是否阻塞生产",
        "Tenant 管理员只看到可行动的租户信息和实例结论，不看到主机、数据库地址或凭据",
        "短信已配置不冒充真实送达，当前 HTTPS 不冒充全部域名资格",
        "备份中心、Worker 心跳和邮件 Provider 的真实缺口可见且不会被静态配置掩盖",
        "精确 readiness/checklist 权限、OpenAPI 投影、双语 Admin 页面和首次运行文档已形成"
      ],
      "evidence": [
        {
          "kind": "git",
          "ref": "c8347692133921114d9ae535f7a893bb8699744c"
        },
        {
          "kind": "pull_request",
          "ref": "https://github.com/peanut-business/peanut-admin/pull/281"
        },
        {
          "kind": "document",
          "ref": "docs/product-status/product-closure-observability.md"
        }
      ],
      "dependencies": [
        "PA-INSTALL-002",
        "PA-BRAND-001",
        "PA-MODULE-002"
      ],
      "paths": [
        "server/app/common/service/readiness/FirstRunReadinessHost.php",
        "server/app/adminapi/controller/config/ReadinessController.php",
        "server/database/migrations/20260827-first-run-readiness.sql",
        "web/src/views/app-setting/readiness/index.vue",
        "docs/peanut-admin-user-manual.md"
      ]
    },
    {
      "id": "PA-OPS-002",
      "name": "单实例运行与维护控制台",
      "area": "operations",
      "status": "verified",
      "summary": "PC20/PC40 已完成：Platform 控制面采用 Core Ops PHP/Web 状态与维护公共合同，展示数据库、迁移、Module、缓存、存储和版本，并可按 reason/revision/时间范围计划或关闭维护窗口。全局后端写门禁已在登记 development 数据库上真实返回 MAINTENANCE_WRITE_BLOCKED 并记录 denied 审计；PC70 pc70q14 已完成固定派生应用 P0-E 7/7 组合资格。",
      "acceptance": [
        "只有具备 platform.ops.read 权限的 Platform Operator 可以访问实例级状态",
        "数据库、应用迁移、Module 目录和 Runtime 存储关键检查失败时整体状态为 unhealthy",
        "非权威缓存读取失败时整体状态为 degraded，状态证据无法构造时接口 fail closed",
        "版本提交、tree、Release 身份、构建时间和应用 migration 摘要使用固定 Core schema",
        "Platform 维护写入同时要求 platform.ops.maintenance.manage 权限、revision 和幂等键；计划与关闭审计和状态变更处于同一事务",
        "活动窗口期间所有 POST/PUT/PATCH/DELETE 在全局中间件真实拒绝并记录 denied Platform 审计；只有精确维护控制路由可穿透且仍受 Platform 权限保护",
        "维护状态读取或审计写入异常时写请求 fail closed；页面隐藏不作为门禁"
      ],
      "evidence": [
        {
          "kind": "git",
          "ref": "187bf95f65a98c5d373c96e4e341a96d65c99b33"
        },
        {
          "kind": "pull_request",
          "ref": "https://github.com/peanut-business/peanut-admin/pull/283"
        },
        {
          "kind": "git",
          "ref": "468dc3b0ae09d351deaac264b34e110fe4a893d4"
        },
        {
          "kind": "pull_request",
          "ref": "https://github.com/peanut-business/peanut-admin/pull/297"
        },
        {
          "kind": "document",
          "ref": "docs/product-status/product-closure-observability.md"
        }
      ],
      "dependencies": [
        "PA-OWNERSHIP-001"
      ],
      "paths": [
        "server/app/platform/controller/PlatformOpsController.php",
        "server/app/platform/service/ops/ApplicationRuntimeStatusProvider.php",
        "server/app/platform/service/ops/PdoMaintenanceWindowStore.php",
        "server/app/common/http/middleware/MaintenanceWriteGateMiddleware.php",
        "platform/src/App.vue",
        "platform/src/api/platform.ts"
      ]
    },
    {
      "id": "PA-DIAGNOSTICS-001",
      "name": "可下载脱敏诊断包",
      "area": "operations",
      "status": "verified",